{
  "schema_version": "4.0",
  "run_id": "20260926T143136Z_eb2968151e",
  "case_id": "case001-v2",
  "source_id": "src-authored-order-csv",
  "source_version": "1",
  "family_id": "fam-authored-order-csv",
  "split": "development",
  "variant_id": "case001-v2.clean",
  "method_id": "official-strict-llm-outline-v4",
  "generation_repeat": 1,
  "kind": "preflight",
  "status": "preflight_only",
  "input_sha256": "089f741805a2230096d8ee2e01154ee381e02f6f7060078a698c642d43760e2a",
  "dataset_freeze_sha256": "ee8f5d2bec15099dad4344a4a3d2760d974f297f3d11a9b52f6edc5c62a8038e",
  "comparison_fingerprint": "33960d2a570a6622d8ec9dd60b2ba2d4cea92c92e59ba3d1d0f877628736b7ee",
  "structural_pass": null,
  "semantic_status": "pending",
  "execution_status": "not_run",
  "failure": {
    "category": "none",
    "stage": null,
    "evidence": []
  },
  "program_ir_status": "not_applicable",
  "started_at_utc": "2026-09-26T14:31:36.084810+00:00",
  "finished_at_utc": "2026-09-26T14:31:37.184387+00:00"
}
