{
  "schema_version": "4.0",
  "run_id": "20260926T141738Z_e9d799ff4c",
  "case_id": "case001-v2",
  "source_id": "src-authored-order-csv",
  "source_version": "1",
  "family_id": "fam-authored-order-csv",
  "split": "development",
  "variant_id": "case001-v2.clean",
  "method_id": "official-chunk-llm-outline-v4",
  "generation_repeat": 1,
  "kind": "preflight",
  "status": "preflight_only",
  "input_sha256": "089f741805a2230096d8ee2e01154ee381e02f6f7060078a698c642d43760e2a",
  "dataset_freeze_sha256": "ee8f5d2bec15099dad4344a4a3d2760d974f297f3d11a9b52f6edc5c62a8038e",
  "comparison_fingerprint": "9331abd22918d1eb1489e6085dd885747b7bfb31ada6d8dea5df3fb6b092ea5a",
  "structural_pass": null,
  "semantic_status": "pending",
  "execution_status": "not_run",
  "failure": {
    "category": "none",
    "stage": null,
    "evidence": []
  },
  "program_ir_status": "not_applicable",
  "started_at_utc": "2026-09-26T14:17:38.248674+00:00",
  "finished_at_utc": "2026-09-26T14:17:39.681929+00:00"
}
